{
  "projectName": "Construction of Submersible Bridge across SUKANAKA Nalah at Matoon",
  "location": "Matoon, SUKANAKA Nalah, Rajasthan",
  "riverName": "SUKANAKA",
  "bridgeType": "submersible",
  "spanLength": 8,
  "numberOfSpans": 6,
  "skew": 0,
  "carriageWidth": 7.5,
  "numberOfLanes": 2,
  "totalLength": 48,
  "hfl": 488.3,
  "bedLevel": 484.1,
  "foundationLevel": 479.5,
  "discharge": 241.7,
  "manningN": 0.03,
  "bedSlope": 1100,
  "laceysSiltFactor": 1.5,
  "crossSectionData": [
    {
      "chainage": 0,
      "gl": 487.8
    },
    {
      "chainage": 10,
      "gl": 486.1
    },
    {
      "chainage": 20,
      "gl": 484.2
    },
    {
      "chainage": 30,
      "gl": 484
    },
    {
      "chainage": 40,
      "gl": 485.3
    },
    {
      "chainage": 50,
      "gl": 488
    }
  ],
  "pierWidth": 1.2,
  "pierLength": 3.5,
  "pierDepth": 3.8,
  "numberOfPiers": 5,
  "pierBaseWidth": 2.5,
  "pierBaseLength": 4,
  "abutmentHeight": 6,
  "abutmentWidth": 3,
  "abutmentDepth": 4.5,
  "dirtWallHeight": 2.5,
  "returnWallLength": 6,
  "concreteGrade": "M25",
  "fck": 25,
  "steelGrade": "Fe415",
  "fy": 415,
  "sbc": 160,
  "phi": 30,
  "gamma": 18,
  "rtl": 489.5,
  "agl": 484.8,
  "nbl": 484.1,
  "ofl": 487.9,
  "dwl": 488.6,
  "deckSlabThickness": 0.25,
  "freeboardAboveHfl": 1,
  "issuingAuthority": "PWD Rajasthan",
  "jobNumber": "SUKANAKA-MATOON-SUBM",
  "hardRockAvailable": false
}