{
  "projectName": "Construction of Submersible Bridge on Syphon Tiraha to Bedla Road across BEDACH River",
  "location": "Syphon Tiraha to Bedla Road, BEDACH River, Udaipur",
  "riverName": "BEDACH",
  "bridgeType": "submersible",
  "spanLength": 8,
  "numberOfSpans": 8,
  "skew": 0,
  "carriageWidth": 7.5,
  "numberOfLanes": 2,
  "totalLength": 64,
  "hfl": 562.8,
  "bedLevel": 558.4,
  "foundationLevel": 553.5,
  "discharge": 387.2,
  "manningN": 0.033,
  "bedSlope": 1150,
  "laceysSiltFactor": 1.5,
  "crossSectionData": [
    {
      "chainage": 0,
      "gl": 562.2
    },
    {
      "chainage": 10,
      "gl": 560.4
    },
    {
      "chainage": 20,
      "gl": 558.5
    },
    {
      "chainage": 30,
      "gl": 558.1
    },
    {
      "chainage": 40,
      "gl": 558.4
    },
    {
      "chainage": 50,
      "gl": 559.3
    },
    {
      "chainage": 60,
      "gl": 561.8
    },
    {
      "chainage": 70,
      "gl": 563
    }
  ],
  "pierWidth": 1.2,
  "pierLength": 3.5,
  "pierDepth": 4,
  "numberOfPiers": 7,
  "pierBaseWidth": 2.5,
  "pierBaseLength": 4.5,
  "abutmentHeight": 6.5,
  "abutmentWidth": 3.5,
  "abutmentDepth": 4.5,
  "dirtWallHeight": 2.5,
  "returnWallLength": 6,
  "concreteGrade": "M25",
  "fck": 25,
  "steelGrade": "Fe415",
  "fy": 415,
  "sbc": 180,
  "phi": 30,
  "gamma": 18,
  "rtl": 563.9,
  "agl": 558.7,
  "nbl": 558.4,
  "ofl": 562.4,
  "dwl": 563.1,
  "deckSlabThickness": 0.25,
  "freeboardAboveHfl": 1,
  "issuingAuthority": "PWD Rajasthan, Udaipur Division",
  "jobNumber": "BEDACH-BEDLA-SUBM",
  "hardRockAvailable": false
}